{
  "id": "prob.classical.equally_likely",
  "title": "Classical probability for equally likely outcomes",
  "level": 2,
  "parents": ["prob.classical"],
  "prerequisites": ["prob.event.complement"],
  "related": [],
  "statement_latex": "$P(A)=m/n$ when $m$ of $n$ equally likely outcomes are favorable.",
  "statement_lean": "theorem kp_equally_likely (m n : ℚ) (h : n ≠ 0) : m / n * n = m := by field_simp [h]",
  "tags": ["probability", "counting"]
}
